{
  "schema_version": "network_process_graph.v1",
  "network_graph_id": "ng_udm_network_minimal",
  "version": 1,
  "source_canvas_graph_id": "canvas_udm_network_minimal",
  "component_schemas": [
    {
      "component_schema_id": "udm_network_minimal_components.v1",
      "components": ["COD", "X_TSS"],
      "unit": "mg/L"
    }
  ],
  "nodes": [
    {
      "node_id": "influent",
      "node_type": "source",
      "process_unit_type": "influent",
      "component_schema_id": "udm_network_minimal_components.v1",
      "initial_conditions": { "COD": 200.0, "X_TSS": 120.0 },
      "volume": 1.0,
      "ports": [{ "port_id": "out", "port_kind": "hydraulic_out" }],
      "model_binding": { "model_kind": "passive_udm", "reaction_enabled": false },
      "parameter_binding": {},
      "unit_metadata": { "flow": "m3/d", "concentration": "mg/L" }
    },
    {
      "node_id": "reactor",
      "node_type": "udm_reactor",
      "process_unit_type": "cstr",
      "component_schema_id": "udm_network_minimal_components.v1",
      "initial_conditions": { "COD": 50.0, "X_TSS": 80.0 },
      "volume": 1000.0,
      "ports": [
        { "port_id": "in", "port_kind": "hydraulic_in" },
        { "port_id": "pump_out", "port_kind": "hydraulic_out" },
        { "port_id": "signal_out", "port_kind": "signal_out" }
      ],
      "model_binding": { "model_kind": "passive_udm", "reaction_enabled": false },
      "parameter_binding": {},
      "unit_metadata": { "volume": "m3", "concentration": "mg/L" }
    },
    {
      "node_id": "clarifier",
      "node_type": "secondary_clarifier_layer",
      "process_unit_type": "settling_layer",
      "component_schema_id": "udm_network_minimal_components.v1",
      "initial_conditions": { "COD": 40.0, "X_TSS": 100.0 },
      "volume": 500.0,
      "ports": [
        { "port_id": "feed", "port_kind": "hydraulic_in" },
        { "port_id": "sludge", "port_kind": "settling_out" }
      ],
      "model_binding": { "model_kind": "passive_udm", "reaction_enabled": false },
      "parameter_binding": {},
      "unit_metadata": { "volume": "m3", "concentration": "mg/L" }
    },
    {
      "node_id": "sludge",
      "node_type": "sink",
      "process_unit_type": "waste_sludge",
      "component_schema_id": "udm_network_minimal_components.v1",
      "initial_conditions": { "COD": 0.0, "X_TSS": 0.0 },
      "volume": 1.0,
      "ports": [{ "port_id": "in", "port_kind": "settling_in" }],
      "model_binding": { "model_kind": "passive_udm", "reaction_enabled": false },
      "parameter_binding": {},
      "unit_metadata": { "concentration": "mg/L" }
    },
    {
      "node_id": "controller",
      "node_type": "controller",
      "process_unit_type": "signal_controller",
      "component_schema_id": "udm_network_minimal_components.v1",
      "initial_conditions": {},
      "ports": [{ "port_id": "signal_in", "port_kind": "signal_in" }],
      "model_binding": { "model_kind": "controller", "reaction_enabled": false },
      "parameter_binding": {},
      "unit_metadata": {}
    }
  ],
  "edges": [
    {
      "edge_id": "e_influent_reactor",
      "edge_kind": "hydraulic",
      "source_node_id": "influent",
      "source_port": "out",
      "target_node_id": "reactor",
      "target_port": "in",
      "component_policy": { "mode": "all", "include": [], "exclude": [] },
      "stream_adapter": null,
      "flow_spec": { "mode": "fixed", "value": 1000.0, "unit": "m3/d" },
      "transport_model": null,
      "metadata": {}
    },
    {
      "edge_id": "e_reactor_clarifier",
      "edge_kind": "pump",
      "source_node_id": "reactor",
      "source_port": "pump_out",
      "target_node_id": "clarifier",
      "target_port": "feed",
      "component_policy": { "mode": "all", "include": [], "exclude": [] },
      "stream_adapter": null,
      "flow_spec": { "mode": "fixed", "value": 1000.0, "unit": "m3/d" },
      "pump": { "head_m": 2.0, "efficiency": 0.75, "energy_enabled": true, "min_flow": 0.0, "max_flow": 1200.0 },
      "transport_model": null,
      "metadata": {}
    },
    {
      "edge_id": "e_clarifier_sludge",
      "edge_kind": "settling",
      "source_node_id": "clarifier",
      "source_port": "sludge",
      "target_node_id": "sludge",
      "target_port": "in",
      "component_policy": { "mode": "include", "include": ["X_TSS"], "exclude": [] },
      "stream_adapter": null,
      "transport_model": {
        "model_id": "takacs_settling.v1",
        "parameters": { "area_m2": 1500.0, "v0_m_per_day": 250.0 }
      },
      "metadata": {}
    },
    {
      "edge_id": "e_reactor_controller",
      "edge_kind": "signal",
      "source_node_id": "reactor",
      "source_port": "signal_out",
      "target_node_id": "controller",
      "target_port": "signal_in",
      "component_policy": { "mode": "exclude", "include": [], "exclude": ["COD", "X_TSS"] },
      "stream_adapter": null,
      "signal_spec": {
        "signal_name": "reactor_tss",
        "source_expression": "X_TSS",
        "sample_period_days": 0.01,
        "hold": "zero_order",
        "delay_days": 0.0,
        "unit": "mg/L"
      },
      "metadata": {}
    }
  ],
  "flow_constraints": [],
  "signal_bindings": [],
  "composites": [],
  "validation": { "status": "valid", "errors": [], "warnings": [] },
  "metadata": { "profile": "minimal_four_edge_contract" }
}

